{
  "$schema": "https://json-schema.org/draft/2020-12/schema",
  "type": "object",
  "required": [
    "_id",
    "age",
    "courses",
    "department",
    "gpa",
    "name",
    "student_id"
  ],
  "properties": {
    "_id": {
      "$ref": "#/$defs/ObjectId"
    },
    "age": {
      "type": "integer"
    },
    "courses": {
      "type": "array",
      "items": {
        "type": "string"
      }
    },
    "department": {
      "type": "string"
    },
    "gpa": {
      "$ref": "#/$defs/Double"
    },
    "name": {
      "type": "string"
    },
    "student_id": {
      "type": "string"
    }
  },
  "$defs": {
    "ObjectId": {
      "type": "object",
      "properties": {
        "$oid": {
          "type": "string",
          "pattern": "^[0-9a-fA-F]{24}$"
        }
      },
      "required": [
        "$oid"
      ],
      "additionalProperties": false
    },
    "Double": {
      "oneOf": [
        {
          "type": "number"
        },
        {
          "type": "object",
          "properties": {
            "$numberDouble": {
              "enum": [
                "Infinity",
                "-Infinity",
                "NaN"
              ]
            }
          }
        }
      ]
    }
  }
}